{
  "checksums": {
    "domains.txt": "a5ee298e34ace6d40c1ae18b0128e6ebb716d39466eb4314858d887c62af0ccc",
    "manifest.json": "6d84014c1d00594ae671899d2795c6ffa31d4192453c24888cd5e4b775d8c85c",
    "provenance.json": "162f5ecce9d9695460db6415fa4faff7064bdd23fa250dc50b852bb5f01d877e",
    "snapshot_content.json": "210f29a63d9a4743e94ac4f7b902c5852b4bc39b4290e2cd3dcff7eeda492b48"
  },
  "content_digest": "b146f59645644fea37bc3f0b14940a03c8dbad2fa9639af34f846363041a19fd",
  "created_at": "2026-09-26T14:04:22.882452+00:00",
  "evidence_digest": "1a6c580b3d16b8c583af46c5c5aac82eaed6ac790a4b27ed2bad69141956cc7d",
  "generator_digest": "68b7ed6b20e97d175fb8d2599cb462c161504a190944f030f7976c8a1c9b78d8",
  "policy_digest": "26b4444e4e74c1b09b091cbf196a44ec4987a355b53aaa83fdc271d14a83f292",
  "reconciliation": {
    "status": "PENDING_COLLECTION_AUDIT"
  },
  "release_digest": "bd7700e11c8ff2c07e7b9321fec93eec2cbb49bf08017295c65c64a50363c13d",
  "release_identity_version": "2",
  "repository": "cn-wanmei/Popular-Rules-Source",
  "schema": "popular_rules_source_release_v1",
  "service_id": "kugou",
  "snapshot_id": "snap-kugou-bd7700e11c8ff2c07e7b9321",
  "validation": {
    "change_assessment": {
      "growth_ratio": 0.0,
      "removal_ratio": 0.0,
      "status": "OK"
    },
    "errors": [],
    "release_state": "CANDIDATE"
  },
  "version": "0.5.0"
}
