{
  "checksums": {
    "domains.txt": "49d81715b12d8915f089f4d09710c6ca41cad95f84414daf068990ea7fb4897d",
    "manifest.json": "5cd5c0dd660c52ee355c09b042a6801d2da361e2f0782fbddc4a417ce223387a",
    "provenance.json": "df746a5b3710b6cf7c9844cf3640fb53f5d6d03fe5de2225a25e783a9934837f",
    "snapshot_content.json": "2c8ada6621fddd47297185f290236ef5a1f4fc224a7b76cf90cd9885b8977724"
  },
  "content_digest": "9337157b68fa226735157680cd64798efa7f753762657df4c68ffadf175ab880",
  "created_at": "2026-09-25T23:14:36.192326+00:00",
  "evidence_digest": "2852a9c2e8c60d7723a4ec7dfa526629b579638db50094cd9bb4b3966b6d61d2",
  "generator_digest": "4b9aa8f4f82bbf045f6d0f5e97035d5229c3105ec91cff8784c75c6ec64e8f17",
  "policy_digest": "70093b9709724c22863c6f1840b5cb8e31afcd4b768d3c3a454a1a94ffb30d11",
  "reconciliation": {
    "status": "PENDING_COLLECTION_AUDIT"
  },
  "release_digest": "49676c0694a9860beb844ee810fb4d41490009454f54e8533bf1fa7cdc7baf12",
  "release_identity_version": "2",
  "repository": "cn-wanmei/Popular-Rules-Source",
  "schema": "popular_rules_source_release_v1",
  "service_id": "cainiao",
  "snapshot_id": "snap-cainiao-49676c0694a9860beb844ee8",
  "validation": {
    "change_assessment": {
      "growth_ratio": 1.0,
      "removal_ratio": 0.0,
      "status": "OK"
    },
    "errors": [],
    "release_state": "CANDIDATE"
  },
  "version": "0.5.0"
}
