{
  "checksums": {
    "domains.txt": "27ac8f54d3b16824b68ad637e9800cee77efe9b38cc02ef7af99647035eb2338",
    "manifest.json": "44203027a73f550edba3287010a4d0d22f6d43ac5bdb8148e5d5b339d6633349",
    "provenance.json": "9c6bae4dffa0acdb96d8425454a2d5f6d321adca70c66c2a1ddd355ced75e538",
    "snapshot_content.json": "9739823e5cf574c2ea665f8cbe1f0b30571d1bcb2bd53c2d98dd31eacef62044"
  },
  "content_digest": "b35d38a44b2feef82aec6fe7b46ce7096ab380fab0bb3d94674ac54933192860",
  "created_at": "2026-09-23T07:51:11.185282+00:00",
  "evidence_digest": "e83a1ac708e9ae0095ffb66e845c5310dd8ef5511495b378b5fbb5bed92d75ac",
  "generator_digest": "4b9aa8f4f82bbf045f6d0f5e97035d5229c3105ec91cff8784c75c6ec64e8f17",
  "policy_digest": "679fa28e918bce1dbbf0edd360d7b1d5b8c676e04ea53b8ac72090fabc0a736e",
  "reconciliation": {
    "status": "PENDING_COLLECTION_AUDIT"
  },
  "release_digest": "461ca160d076aaffa913407cec0ab2f66c7e24fd98102c34bee05f04afa29886",
  "release_identity_version": "2",
  "repository": "cn-wanmei/Popular-Rules-Source",
  "schema": "popular_rules_source_release_v1",
  "service_id": "alibabacloud",
  "snapshot_id": "snap-alibabacloud-461ca160d076aaffa913407c",
  "validation": {
    "change_assessment": {
      "growth_ratio": 0.0,
      "removal_ratio": 0.0,
      "status": "OK"
    },
    "errors": [],
    "release_state": "CANDIDATE"
  },
  "version": "0.5.0"
}
