{
  "checksums": {
    "domains.txt": "fcf0ced4cf30e52df70f34614e5ea7e710b79e4c1d13d2c64021e5cf72838bc7",
    "manifest.json": "5fe9f681ec155c4038a7e318d874ab18621eabdfefbe3430863f012fec7fb5d5",
    "provenance.json": "809e6bb3126b163cf627a5d4dadc0eb34255a4150e47cf481f378ea2713f0214",
    "snapshot_content.json": "41f8f7e0631c49cc2079fad4643449cf604870018011375319e8058fdb5b3628"
  },
  "content_digest": "978b9ad0247cd0c827c59aab6343c8b59650987045ddfd25fced51198362b4f4",
  "created_at": "2026-09-26T14:05:52.744182+00:00",
  "evidence_digest": "36f8bc024fc51ebdd5f1ba8d7932f29e61d840c3d9c256e2a4b857618912a073",
  "generator_digest": "68b7ed6b20e97d175fb8d2599cb462c161504a190944f030f7976c8a1c9b78d8",
  "policy_digest": "aca4e8b67f32343bf1062d2839270905d180345a2c8dd14ff190b19151c4a176",
  "reconciliation": {
    "status": "PENDING_COLLECTION_AUDIT"
  },
  "release_digest": "cc1e48c936f2293870e7e2c0aac96c55937cc5d4ee6d97e785ff99bd04550d12",
  "release_identity_version": "2",
  "repository": "cn-wanmei/Popular-Rules-Source",
  "schema": "popular_rules_source_release_v1",
  "service_id": "chatgpt",
  "snapshot_id": "snap-chatgpt-cc1e48c936f2293870e7e2c0",
  "validation": {
    "change_assessment": {
      "growth_ratio": 0.0,
      "removal_ratio": 0.0,
      "status": "OK"
    },
    "errors": [],
    "release_state": "CANDIDATE"
  },
  "version": "0.5.0"
}
