{
  "checksums": {
    "domains.txt": "4f2521212149543f1f267cb4b7d9bb89a544f168b33bd12ecd3207aaaedd412d",
    "manifest.json": "7ec0440bae753ae99cd2c17f6778475cfada18441c8b0d9f486e132de2003b5a",
    "provenance.json": "a76f133d559eed96315e5b45c2fb334fd540bf90318e2e8838e864e78495ba25",
    "snapshot_content.json": "af54e121191a3a73683c81f202a6ea7b0c0528b23ac4c60613ce651706e62525"
  },
  "content_digest": "f6aca74ba68593d61d9abeb2d6fded60d6f33ec92bb2c8c39b8ac1e2cd05c475",
  "created_at": "2026-09-26T10:23:13.612386+00:00",
  "evidence_digest": "6f0f1a5fa9ac48f6b610a01a700347f531503c15efcaf06fa69a3abb9412e36e",
  "generator_digest": "4b9aa8f4f82bbf045f6d0f5e97035d5229c3105ec91cff8784c75c6ec64e8f17",
  "policy_digest": "b4b1b408ca2bfe03e2af68103ed2e3dc598350120217d287733a119f9c7f82aa",
  "reconciliation": {
    "status": "PENDING_COLLECTION_AUDIT"
  },
  "release_digest": "e874413d8245a8df0eb4b75ef606b93d8cc3aac33fce4304da145143452ba50e",
  "release_identity_version": "2",
  "repository": "cn-wanmei/Popular-Rules-Source",
  "schema": "popular_rules_source_release_v1",
  "service_id": "tmall",
  "snapshot_id": "snap-tmall-e874413d8245a8df0eb4b75e",
  "validation": {
    "change_assessment": {
      "growth_ratio": 1.0,
      "removal_ratio": 0.0,
      "status": "OK"
    },
    "errors": [],
    "release_state": "CANDIDATE"
  },
  "version": "0.5.0"
}
