{
  "checksums": {
    "domains.txt": "261bb8c24cb953a8c0b911b1d6e20368f0e65f60fffe8c46069e3cf3e23384db",
    "manifest.json": "d42905f7c316f6b724d5ba8283cb0494d4bc5445389f639bdc5e2c23ef0b5e56",
    "provenance.json": "373e80ab35af4cf60748b324c5f79d19a939e29bc243df69aa23d39b407008aa",
    "snapshot_content.json": "52f22930d00802a173c00ba270a87ad930ef4a299b1a91b300ec985a20e51deb"
  },
  "content_digest": "bcfc8b2ee8c69d2e45f6b301bd41aaaf881035e8600859cc66959253ccca3557",
  "created_at": "2026-09-26T12:53:55.486339+00:00",
  "evidence_digest": "bead0542fe259b8a2c4dbf9a339eb93acbf84f7c2a1a1314ee5eb69d065ff9ac",
  "generator_digest": "68b7ed6b20e97d175fb8d2599cb462c161504a190944f030f7976c8a1c9b78d8",
  "policy_digest": "684cb73e62101e2d04555e94ac138a7438fe5165508d2bb2c38b5acf72877112",
  "reconciliation": {
    "status": "PENDING_COLLECTION_AUDIT"
  },
  "release_digest": "eb7a2c816de0efe942519ac898f39511249fc13dc45c94bd228221553248c7c5",
  "release_identity_version": "2",
  "repository": "cn-wanmei/Popular-Rules-Source",
  "schema": "popular_rules_source_release_v1",
  "service_id": "goodreads",
  "snapshot_id": "snap-goodreads-eb7a2c816de0efe942519ac8",
  "validation": {
    "change_assessment": {
      "growth_ratio": 0.0,
      "removal_ratio": 0.0,
      "status": "OK"
    },
    "errors": [],
    "release_state": "CANDIDATE"
  },
  "version": "0.5.0"
}
