{
  "checksums": {
    "domains.txt": "0242e7b4831a05e52ee1e94cec1d03d52a7d03c2bea8122d71111fca4e4d4504",
    "manifest.json": "c8d3a3e2b9b009d44fd07570025fe81c4bc2187dd92c34b17a543dd0124d40d8",
    "provenance.json": "e73cea506479a7d38a9ce1a4114340d8bd5bd9dfe1bec43de0e09de2de07fe4e",
    "snapshot_content.json": "2ae155b84235b5863b3438bd5bf647d1215a02f8d6e3e0d7fd9d05dd7354e3cd"
  },
  "content_digest": "3a8261bda6064e8188c613778d7c9d34ad57cd04d83b22a17125835ff427966a",
  "created_at": "2026-09-23T07:30:25.855586+00:00",
  "evidence_digest": "fbf7dce84148acfe49edade5ccd835e531be01b2458cfac4502088d647fb1516",
  "generator_digest": "7219ee0f6ac041bb585edefea0602b062e704fea081c18294c2698a26f5b1151",
  "policy_digest": "21cda7c04409602f4f1efdbd49f8e2cb5dc825c1bda82352c5e7ae624dd86a1f",
  "reconciliation": {
    "status": "PENDING_COLLECTION_AUDIT"
  },
  "release_digest": "0a8e64e56c03019bef5f6c1ec825acb309fca70cf20baf8ee72cb5089fc40929",
  "release_identity_version": "2",
  "repository": "cn-wanmei/Popular-Rules-Source",
  "schema": "popular_rules_source_release_v1",
  "service_id": "baidunetdisk",
  "snapshot_id": "snap-baidunetdisk-0a8e64e56c03019bef5f6c1e",
  "validation": {
    "change_assessment": {
      "growth_ratio": 0.0,
      "removal_ratio": 0.0,
      "status": "OK"
    },
    "errors": [],
    "release_state": "CANDIDATE"
  },
  "version": "0.5.0"
}
