{
  "checksums": {
    "domains.txt": "16b9f90cd11ff786abfe0230ef3f0475165b224410674bbb3954615752ae2d25",
    "manifest.json": "8a1f16d1976739bfc34314804a67a1114585626c8a862287253d29fd625b24ab",
    "provenance.json": "b49261538d2e14cff28239b1a522ce8b222d844707abe799f2074ea83c0b4f26",
    "snapshot_content.json": "50bfcd427e7b793d7578b4fa7b97a41d7e7ef4bf98decbe3a7caae464ce6b7c1"
  },
  "content_digest": "2b52d14076a4d968267b3c36a8103ed26d0158e04050f0584d9de6cacd382da5",
  "created_at": "2026-09-26T12:53:58.990822+00:00",
  "evidence_digest": "96fba42f08e9866640084e70aeaf571e32c268ec9fe138bdefbfc5a3bc2ea5de",
  "generator_digest": "68b7ed6b20e97d175fb8d2599cb462c161504a190944f030f7976c8a1c9b78d8",
  "policy_digest": "35cdfaec8d62d8af295c9179afd802cab31541bfb02c8b02dc70d916aaec067a",
  "reconciliation": {
    "status": "PENDING_COLLECTION_AUDIT"
  },
  "release_digest": "7bf2ee650853808906839699a9ec05670f49d7f941de9fb01137f009c17125fc",
  "release_identity_version": "2",
  "repository": "cn-wanmei/Popular-Rules-Source",
  "schema": "popular_rules_source_release_v1",
  "service_id": "anthropic-platform",
  "snapshot_id": "snap-anthropic-platform-7bf2ee650853808906839699",
  "validation": {
    "change_assessment": {
      "growth_ratio": 0.0,
      "removal_ratio": 0.0,
      "status": "OK"
    },
    "errors": [],
    "release_state": "CANDIDATE"
  },
  "version": "0.5.0"
}
