{
  "checksums": {
    "domains.txt": "738ec6e8a3576e5d8d455ddd5abfa5ffabf035889b33f4d5189455c2aebb0e69",
    "manifest.json": "96f7da3a2b12287304798520c68701030add65a9fe3bc6d1547f4620fc90b74c",
    "provenance.json": "154adcf2c91930d28ee1ad148ac547009460f44132ffb70626265b8c285e760f",
    "snapshot_content.json": "7f71f2fe2393bc9151b43c106a48528ce05ea1a8441fbcfa014ced6fca03053a"
  },
  "content_digest": "844dc349a7c8bfc578b30952e4818d9bd347e1e904ca043a240325fa0d1a6246",
  "created_at": "2026-09-26T12:56:41.128780+00:00",
  "evidence_digest": "7465e0bf214d7e173ce3f86ec0c861f2077daaad89dbad4e30552487041aec58",
  "generator_digest": "68b7ed6b20e97d175fb8d2599cb462c161504a190944f030f7976c8a1c9b78d8",
  "policy_digest": "51a04f36f18976eba941cbb423e1a5cadab83d2e184e9a9ed0af3eb6f4daea45",
  "reconciliation": {
    "status": "PENDING_COLLECTION_AUDIT"
  },
  "release_digest": "7e43ec1fc056a357c90f73109cc8bd7ff95e978d947fef2957c53d75d7d6bb1f",
  "release_identity_version": "2",
  "repository": "cn-wanmei/Popular-Rules-Source",
  "schema": "popular_rules_source_release_v1",
  "service_id": "wecom",
  "snapshot_id": "snap-wecom-7e43ec1fc056a357c90f7310",
  "validation": {
    "change_assessment": {
      "growth_ratio": 1.0,
      "removal_ratio": 0.0,
      "status": "OK"
    },
    "errors": [],
    "release_state": "CANDIDATE"
  },
  "version": "0.5.0"
}
