{
  "checksums": {
    "domains.txt": "49d81715b12d8915f089f4d09710c6ca41cad95f84414daf068990ea7fb4897d",
    "manifest.json": "7228226e4ed0d0b5d5b6b36f9d344f51f4f7d7f77db601a6e8f197a4672900c8",
    "provenance.json": "f1d4f47a887858e91d2544bb5fe7bdb55b26beb5a7ff5556687a5968fb22e183",
    "snapshot_content.json": "7031a6fa1cd618e95faeb024622301246a563650783b7a43c43962976871c792"
  },
  "content_digest": "131cd569d9155440bb1f4ade7dcfd2cdcea045818e822d26a77e7d8952a32de1",
  "created_at": "2026-09-23T11:28:01.974868+00:00",
  "evidence_digest": "084c971084f3e3bb8f25848a29fba0328da9634f0592debcfc0ebd69c4f1229b",
  "generator_digest": "4b9aa8f4f82bbf045f6d0f5e97035d5229c3105ec91cff8784c75c6ec64e8f17",
  "policy_digest": "70093b9709724c22863c6f1840b5cb8e31afcd4b768d3c3a454a1a94ffb30d11",
  "reconciliation": {
    "status": "PENDING_COLLECTION_AUDIT"
  },
  "release_digest": "025fcd0a33b38eb97b927b65b28f7ab5ead0ce225cd0bddf9290e6c2f76e23c2",
  "release_identity_version": "2",
  "repository": "cn-wanmei/Popular-Rules-Source",
  "schema": "popular_rules_source_release_v1",
  "service_id": "cainiao",
  "snapshot_id": "snap-cainiao-025fcd0a33b38eb97b927b65",
  "validation": {
    "change_assessment": {
      "growth_ratio": 1.0,
      "removal_ratio": 0.0,
      "status": "OK"
    },
    "errors": [],
    "release_state": "CANDIDATE"
  },
  "version": "0.5.0"
}
