{
  "checksums": {
    "domains.txt": "49d81715b12d8915f089f4d09710c6ca41cad95f84414daf068990ea7fb4897d",
    "manifest.json": "fabb64b589a9c9e8491e85272e9fdb61cfaec8993ed9f287b9b2a0607c83ff3c",
    "provenance.json": "51e9afa0ae4cd507bfd4800e9a0a6798643951a80a0b258f341da1a5800e85af",
    "snapshot_content.json": "0014bab7f139b7b02c6775db18a7cbd03207630dfeca6d7226ac9d368c2a0179"
  },
  "content_digest": "18f303bf2b46cf7e28f2517a9926ffcccea42f1c16b492814b87518e9601a488",
  "created_at": "2026-09-23T11:28:49.864777+00:00",
  "evidence_digest": "261e77120ab11923d34db4288191f4826750f47fc29004228ee9ada9be93cf20",
  "generator_digest": "4b9aa8f4f82bbf045f6d0f5e97035d5229c3105ec91cff8784c75c6ec64e8f17",
  "policy_digest": "70093b9709724c22863c6f1840b5cb8e31afcd4b768d3c3a454a1a94ffb30d11",
  "reconciliation": {
    "status": "PENDING_COLLECTION_AUDIT"
  },
  "release_digest": "258e617bdcdaa7536ba91504781f3537b48d99f3269a8e564df9475a9af34b54",
  "release_identity_version": "2",
  "repository": "cn-wanmei/Popular-Rules-Source",
  "schema": "popular_rules_source_release_v1",
  "service_id": "cainiao",
  "snapshot_id": "snap-cainiao-258e617bdcdaa7536ba91504",
  "validation": {
    "change_assessment": {
      "growth_ratio": 1.0,
      "removal_ratio": 0.0,
      "status": "OK"
    },
    "errors": [],
    "release_state": "CANDIDATE"
  },
  "version": "0.5.0"
}
